Grant Number	Group	Modality	GEO accession	SRA accession	PRIDE accession	OMERO accession	Other database	Other database accession	DOI	PMID	Pub Year	Title	Abstract	MeSH Keywords	MeSH Extracted	PubMed Keywords	Authors	Author Affiliation	RCR	Total Citations	Journal Name	Journal Volume	Journal Issue	Journal Pages
U19MH106434	Group 3								10.1038/mp.2016.260	28242870	2018	Neurons derived from patients with bipolar disorder divide into intrinsically different sub-populations of neurons, predicting the patients' responsiveness to lithium.	Bipolar disorder (BD) is a progressive psychiatric disorder with more than 3% prevalence worldwide. Affected individuals experience recurrent episodes of depression and mania, disrupting normal life and increasing the risk of suicide greatly. The complexity and genetic heterogeneity of psychiatric disorders have challenged the development of animal and cellular models. We recently reported that hippocampal dentate gyrus (DG) neurons differentiated from induced pluripotent stem cell (iPSC)-derived fibroblasts of BD patients are electrophysiologically hyperexcitable. Here we used iPSCs derived from Epstein-Barr virus-immortalized B-lymphocytes to verify that the hyperexcitability of DG-like neurons is reproduced in this different cohort of patients and cells. Lymphocytes are readily available for research with a large number of banked lines with associated patient clinical description. We used whole-cell patch-clamp recordings of over 460 neurons to characterize neurons derived from control individuals and BD patients. Extensive functional analysis showed that intrinsic cell parameters are very different between the two groups of BD neurons, those derived from lithium (Li)-responsive (LR) patients and those derived from Li-non-responsive (NR) patients, which led us to partition our BD neurons into two sub-populations of cells and suggested two different subdisorders. Training a Naïve Bayes classifier with the electrophysiological features of patients whose responses to Li are known allows for accurate classification with more than 92% success rate for a new patient whose response to Li is unknown. Despite their very different functional profiles, both populations of neurons share a large, fast after-hyperpolarization (AHP). We therefore suggest that the large, fast AHP is a key feature of BD and a main contributor to the fast, sustained spiking abilities of BD neurons. Confirming our previous report with fibroblast-derived DG neurons, chronic Li treatment reduced the hyperexcitability in the lymphoblast-derived LR group but not in the NR group, strengthening the validity and utility of this new human cellular model of BD.	Adult;Antimanic Agents;Antipsychotic Agents;Biomarkers, Pharmacological;Bipolar Disorder;Case-Control Studies;Cell Differentiation;Dentate Gyrus;Female;Hippocampus;Humans;Induced Pluripotent Stem Cells;Lithium;Lithium Compounds;Male;Neurons;Patch-Clamp Techniques	Ability;Adult;Animals;Antimanic Agents;Antipsychotic Agents;B-Lymphocytes;Biomarkers, Pharmacological;Bipolar Disorder;Case-Control Studies;Cell Differentiation;Cells;Classification;Dentate Gyrus;Depression;Female;Fibroblasts;Genetic Heterogeneity;Herpesvirus 4, Human;Hippocampus;Humans;Induced Pluripotent Stem Cells;Life;Lithium;Lithium Compounds;Lymphocytes;Male;Mania;Mental Disorders;Neurons;News;Patch-Clamp Techniques;Patients;Population;Prevalence;Report;Research;Risk;Suicide;Therapeutics		Stern, S;Santos, R;Marchetto, M C;Mendes, A P D;Rouleau, G A;Biesmans, S;Wang, Q-W;Yao, J;Charnay, P;Bang, A G;Alda, M;Gage, F H	[Salk Institute for Biological Studies];[Inserm, Institut de Biologie de l'Ecole Normale Superieure IBENS, National Center for Scientific Research (France), PSL Research University, Salk Institute for Biological Studies, École Normale Supérieure];[Salk Institute for Biological Studies];[Salk Institute for Biological Studies];[McGill University, Montreal Neurological Institute and Hospital];[Sanford Burnham Prebys Medical Discovery Institute];[Tsinghua University];[Tsinghua University];[Inserm, Institut de Biologie de l'Ecole Normale Superieure IBENS, National Center for Scientific Research (France), PSL Research University, École Normale Supérieure];[Sanford Burnham Prebys Medical Discovery Institute];[Dalhousie University];[Salk Institute for Biological Studies]	4.28	67	Molecular psychiatry	23	6	1453-1465
U19MH106434	Group 3								10.1007/s00441-017-2670-4	28812143	2018	Serotonin in psychiatry: in vitro disease modeling using patient-derived neurons.	Several lines of evidence implicate serotonin in the etiology of multiple psychiatric disorders, especially mood disorders, such as major depressive disorder (MDD) and bipolar disorder (BD). Much of our current understanding of biological mechanisms underlying serotonergic alterations in mood disorders comes from animal studies. Innovation in induced pluripotent stem cell and transdifferentiation technologies for deriving neurons from adult humans has enabled the study of disease-relevant cellular phenotypes in vitro. In this context, human serotonergic neurons can now be generated using three recently published methodologies. In this mini-review, we broadly discuss evidence linking altered serotonergic neurotransmission in MDD and BD and focus on recently published methods for generating human serotonergic neurons in vitro.	Adult;Animals;Bipolar Disorder;Cell Culture Techniques;Cell Transdifferentiation;Depressive Disorder, Major;Humans;Induced Pluripotent Stem Cells;Mice;Models, Neurological;Serotonergic Neurons;Serotonin;Synaptic Transmission	Adult;Animals;Biopharmaceuticals;Bipolar Disorder;Cell Culture Techniques;Cell Transdifferentiation;Comprehension;Depression;Depressive Disorder, Major;Disease;Humans;In Vitro;Induced Pluripotent Stem Cells;Mental Disorders;Methods;Mice;Models, Neurological;Mood Disorders;Neurons;Patients;Phenotype;Psychiatry;Review;Serotonergic Neurons;Serotonin;Synaptic Transmission;Technology	5-HT;Bipolar;Depression;Human serotonergic neurons;Induced pluripotent stem cells;Mood disorders;Transdifferentiation;iSN	Vadodaria, Krishna C;Stern, Shani;Marchetto, Maria C;Gage, Fred H	[Salk Institute for Biological Studies];[Salk Institute for Biological Studies];[Salk Institute for Biological Studies];[Salk Institute for Biological Studies]	1.55	21	Cell and tissue research	371	1	161-170
U19MH106434	Group 3								10.1038/mp.2017.175	28924182	2018	An in vitro model of lissencephaly: expanding the role of DCX during neurogenesis.	Lissencephaly comprises a spectrum of brain malformations due to impaired neuronal migration in the developing cerebral cortex. Classical lissencephaly is characterized by smooth cerebral surface and cortical thickening that result in seizures, severe neurological impairment and developmental delay. Mutations in the X-chromosomal gene DCX, encoding doublecortin, is the main cause of classical lissencephaly. Much of our knowledge about DCX-associated lissencephaly comes from post-mortem analyses of patient's brains, mainly since animal models with DCX mutations do not mimic the disease. In the absence of relevant animal models and patient brain specimens, we took advantage of induced pluripotent stem cell (iPSC) technology to model the disease. We established human iPSCs from two males with mutated DCX and classical lissencephaly including smooth brain and abnormal cortical morphology. The disease was recapitulated by differentiation of iPSC into neural cells followed by expression profiling and dissection of DCX-associated functions. Here we show that neural stem cells, with absent or reduced DCX protein expression, exhibit impaired migration, delayed differentiation and deficient neurite formation. Hence, the patient-derived iPSCs and neural stem cells provide a system to further unravel the functions of DCX in normal development and disease.	Brain;Cell Differentiation;Cell Movement;Cells, Cultured;Cerebral Cortex;Doublecortin Domain Proteins;Doublecortin Protein;Fibroblasts;Humans;Induced Pluripotent Stem Cells;Infant;Infant, Newborn;Lissencephaly;Male;Microtubule-Associated Proteins;Neural Stem Cells;Neurites;Neurogenesis;Neurons;Neuropeptides	Brain;Cell Differentiation;Cell Movement;Cells;Cells, Cultured;Cerebral Cortex;Disease;Dissection;Exhibition;Fibroblasts;Genes;Humans;In Vitro;Induced Pluripotent Stem Cells;Infant;Infant, Newborn;Knowledge;Lissencephalies, Classical;Lissencephaly;Male;Microtubule-Associated Proteins;Models, Animal;Mutation;Neural Stem Cells;Neurites;Neurogenesis;Neurons;Neuropeptides;Patients;Protein Domains;Proteins;Role;Seizures;Technology		Shahsavani, M;Pronk, R J;Falk, R;Lam, M;Moslem, M;Linker, S B;Salma, J;Day, K;Schuster, J;Anderlid, B-M;Dahl, N;Gage, F H;Falk, A	[Karolinska Institute];[Karolinska Institute];[Karolinska Institute];[Karolinska Institute];[Karolinska Institute];[Salk Institute for Biological Studies];[Karolinska Institute];[Karolinska Institute];[Uppsala University];[Karolinska University Hospital];[Uppsala University];[Salk Institute for Biological Studies];[Karolinska Institute]	1.56	24	Molecular psychiatry	23	7	1674-1684
U19MH106434	Group 3								10.12688/f1000research.12684.1	29568500	2018	Radial glial cells in the adult dentate gyrus: what are they and where do they come from?	Adult neurogenesis occurs in the dentate gyrus in the mammalian hippocampus. These new neurons arise from neural precursor cells named radial glia-like cells, which are situated in the subgranular zone of the dentate gyrus. Here, we review the emerging topic of precursor heterogeneity in the adult subgranular zone. We also discuss how this heterogeneity may be established during development and focus on the embryonic origin of the dentate gyrus and radial glia-like stem cells. Finally, we discuss recently developed single-cell techniques, which we believe will be critical to comprehensively investigate adult neural stem cell origin and heterogeneity.		Adult;Cells;Dentate Gyrus;Hippocampus;Neural Stem Cells;Neurogenesis;Neurons;News;Radial Glial Cells;Review;Stem Cells	dentate gyrus;radial glial cells;stem cell heterogeneity	Berg, Daniel A;Bond, Allison M;Ming, Guo-Li;Song, Hongjun	[University of Pennsylvania];[University of Pennsylvania];[University of Pennsylvania];[University of Pennsylvania]	2.86	44	F1000Research	7		277
U19MH106434	Group 3								10.1038/nprot.2017.152	29470464	2018	Generation of human brain region-specific organoids using a miniaturized spinning bioreactor.	Human brain organoids, 3D self-assembled neural tissues derived from pluripotent stem cells, are important tools for studying human brain development and related disorders. Suspension cultures maintained by spinning bioreactors allow for the growth of large organoids despite the lack of vasculature, but commercially available spinning bioreactors are bulky in size and have low throughput. Here, we describe the procedures for building the miniaturized multiwell spinning bioreactor SpinΩ from 3D-printed parts and commercially available hardware. We also describe how to use SpinΩ to generate forebrain, midbrain and hypothalamus organoids from human induced pluripotent stem cells (hiPSCs). These organoids recapitulate key dynamic features of the developing human brain at the molecular, cellular and structural levels. The reduction in culture volume, increase in throughput and reproducibility achieved using our bioreactor and region-specific differentiation protocols enable quantitative modeling of brain disorders and compound testing. This protocol takes 14-84 d to complete (depending on the type of brain region-specific organoids and desired developmental stages), and organoids can be further maintained over 200 d. Competence with hiPSC culture is required for optimal results.	Bioreactors;Brain;Cell Culture Techniques;Cell Differentiation;Humans;Hydrodynamics;Induced Pluripotent Stem Cells;Organoids;Pluripotent Stem Cells;Printing, Three-Dimensional;Reproducibility of Results	Bioreactors;Brain;Brain Diseases;Cell Culture Techniques;Cell Differentiation;Competence;Culture;Generations;Growth;Human Induced Pluripotent Stem Cells;Humans;Hydrodynamics;Hypothalamus;Induced Pluripotent Stem Cells;Mesencephalon;Organoids;Pluripotent Stem Cells;Printing, Three-Dimensional;Procedures;Prosencephalon;Reproducibility of Results;Self;Suspensions;Tissues		Qian, Xuyu;Jacob, Fadi;Song, Mingxi Max;Nguyen, Ha Nam;Song, Hongjun;Ming, Guo-Li	[Johns Hopkins School of Medicine, Perelman School of Medicine, University of Pennsylvania];[Johns Hopkins School of Medicine, Perelman School of Medicine, University of Pennsylvania];[Brandeis University];[Johns Hopkins School of Medicine];[Perelman School of Medicine, University of Pennsylvania];[Perelman School of Medicine, University of Pennsylvania]	10.12	171	Nature protocols	13	3	565-580
U19MH106434	Group 3								10.1016/j.stem.2018.04.009	29727680	2018	Efficient Generation of CA3 Neurons from Human Pluripotent Stem Cells Enables Modeling of Hippocampal Connectivity In Vitro.	Despite widespread interest in using human induced pluripotent stem cells (hiPSCs) in neurological disease modeling, a suitable model system to study human neuronal connectivity is lacking. Here, we report a comprehensive and efficient differentiation paradigm for hiPSCs that generate multiple CA3 pyramidal neuron subtypes as detected by single-cell RNA sequencing (RNA-seq). This differentiation paradigm exhibits characteristics of neuronal network maturation, and rabies virus tracing revealed synaptic connections between stem cell-derived dentate gyrus (DG) and CA3 neurons in vitro recapitulating the neuronal connectivity within the hippocampus. Because hippocampal dysfunction has been implicated in schizophrenia, we applied DG and CA3 differentiation paradigms to schizophrenia-patient-derived hiPSCs. We detected reduced activity in DG-CA3 co-culture and deficits in spontaneous and evoked activity in CA3 neurons from schizophrenia-patient-derived hiPSCs. Our approach offers critical insights into the network activity aspects of schizophrenia and may serve as a promising tool for modeling diseases with hippocampal vulnerability. VIDEO ABSTRACT.	Adult;Animals;Cell Differentiation;Dentate Gyrus;Female;Hippocampus;Humans;Induced Pluripotent Stem Cells;Male;Mice;Mice, Inbred C57BL;Mice, Inbred NOD;Mice, SCID;Middle Aged;Neurons;Schizophrenia;Young Adult	Abstracts;Adult;Animals;Cell Differentiation;Cells;Coculture Techniques;Dentate Gyrus;Disease;Exhibition;Female;Generations;Hippocampus;Human Induced Pluripotent Stem Cells;Humans;In Vitro;Induced Pluripotent Stem Cells;Male;Mice;Mice, Inbred C57BL;Mice, Inbred NOD;Mice, SCID;Middle Aged;Neurons;Patients;Pluripotent Stem Cells;Pyramidal Cells;RNA-Seq;Rabies;Rabies virus;Report;Schizophrenia;Sequence Determinations, RNA;Stem Cells;Young Adult	CA3;DG;disease-in-a-dish;hippocampus;neuronal diversity;pyramidal neurons;rabies tracing;schizophrenia;single cell sequencing;synaptic connectivity	Sarkar, Anindita;Mei, Arianna;Paquola, Apua C M;Stern, Shani;Bardy, Cedric;Klug, Jason R;Kim, Stacy;Neshat, Neda;Kim, Hyung Joon;Ku, Manching;Shokhirev, Maxim N;Adamowicz, David H;Marchetto, Maria C;Jappelli, Roberto;Erwin, Jennifer A;Padmanabhan, Krishnan;Shtrahman, Matthew;Jin, Xin;Gage, Fred H	[Salk Institute for Biological Studies];[Salk Institute for Biological Studies];[Johns Hopkins School of Medicine, Lieber Institute for Brain Development, Salk Institute for Biological Studies];[Salk Institute for Biological Studies];[Flinders University, Salk Institute for Biological Studies, South Australian Health and Medical Research Institute];[Salk Institute for Biological Studies];[Salk Institute for Biological Studies];[Salk Institute for Biological Studies];[Salk Institute for Biological Studies, University of Nebraska Medical Center];[Salk Institute for Biological Studies];[Salk Institute for Biological Studies];[Salk Institute for Biological Studies, UC San Diego School of Medicine];[Salk Institute for Biological Studies];[Salk Institute for Biological Studies];[Johns Hopkins School of Medicine, Lieber Institute for Brain Development, Salk Institute for Biological Studies];[Salk Institute for Biological Studies, University of Rochester];[Salk Institute for Biological Studies, UC San Diego School of Medicine];[Salk Institute for Biological Studies];[Salk Institute for Biological Studies]	3.32	58	Cell stem cell	22	5	684-697.e9
U19MH106434	Group 3								10.1186/s13073-018-0518-5	29386063	2018	Synaptic dysfunction in complex psychiatric disorders: from genetics to mechanisms.	Breakthroughs on many fronts have provided strong evidence to support synaptic dysfunction as a causal factor for neuropsychiatric diseases. Genetic studies have identified variants implicated in novel biological and synaptic pathways, and animal and patient-derived induced pluripotent stem cell-based models have allowed mechanistic investigations of synaptic dysfunction in pathological processes.	Animals;Brain;Humans;Mental Disorders;Synapses	Animals;Biopharmaceuticals;Brain;Genetics;Hereditary Diseases;Humans;Induced Pluripotent Stem Cells;Mental Disorders;Pathologic Processes;Patients;Synapses		Wang, Xinyuan;Christian, Kimberly M;Song, Hongjun;Ming, Guo-Li	[Fudan University, Perelman School of Medicine, University of Pennsylvania];[Perelman School of Medicine, University of Pennsylvania];[Perelman School of Medicine, University of Pennsylvania];[Perelman School of Medicine, University of Pennsylvania]	0.98	16	Genome medicine	10	1	9
U19MH106434	Group 3								10.1083/jcb.201802117	29666150	2018	Epigenetics and epitranscriptomics in temporal patterning of cortical neural progenitor competence.	During embryonic brain development, neural progenitor/stem cells (NPCs) sequentially give rise to different subtypes of neurons and glia via a highly orchestrated process. To accomplish the ordered generation of distinct progenies, NPCs go through multistep transitions of their developmental competence. The molecular mechanisms driving precise temporal coordination of these transitions remains enigmatic. Epigenetic regulation, including changes in chromatin structures, DNA methylation, and histone modifications, has been extensively investigated in the context of cortical neurogenesis. Recent studies of chemical modifications on RNA, termed epitranscriptomics, have also revealed their critical roles in neural development. In this review, we discuss advances in understanding molecular regulation of the sequential lineage specification of NPCs in the embryonic mammalian brain with a focus on epigenetic and epitranscriptomic mechanisms. In particular, the discovery of lineage-specific gene transcripts undergoing rapid turnover in NPCs suggests that NPC developmental fate competence is determined much earlier, before the final cell division, and is more tightly controlled than previously appreciated. We discuss how multiple regulatory systems work in harmony to coordinate NPC behavior and summarize recent findings in the context of a model of epigenetic and transcriptional prepatterning to explain NPC developmental competence.	Animals;Cerebral Cortex;DNA Methylation;Epigenesis, Genetic;Humans;Neural Stem Cells;Time Factors;Transcription, Genetic	Animals;Behavior;Brain;Cell Division;Cerebral Cortex;Chromatin;Competence;Comprehension;DNA Methylation;Epigenesis, Genetic;Epigenetics;Generations;Genes;Histone Code;Humans;Neural Stem Cells;Neurogenesis;Neuroglia;Neurons;RNA;Regulation;Review;Role;Stem Cells;Time Factors;Transcription, Genetic;Work		Yoon, Ki-Jun;Vissers, Caroline;Ming, Guo-Li;Song, Hongjun	[University of Pennsylvania];[Johns Hopkins School of Medicine];[Johns Hopkins School of Medicine, University of Pennsylvania];[Johns Hopkins School of Medicine, University of Pennsylvania]	2.00	41	The Journal of cell biology	217	6	1901-1914
U19MH106434	Group 3								10.1186/s13073-017-0512-3	29301565	2018	Modeling psychiatric disorders using patient stem cell-derived neurons: a way forward.	Our understanding of the neurobiology of psychiatric disorders remains limited, and biomarker-based clinical management is yet to be developed. Induced pluripotent stem cell (iPSC) technology has revolutionized our capacity to generate patient-derived neurons to model psychiatric disorders. Here, we highlight advantages and caveats of iPSC disease modeling and outline strategies for addressing current challenges.	Animals;Humans;Induced Pluripotent Stem Cells;Mental Disorders;Models, Biological;Neurons	Animals;Biomarkers;Comprehension;Disease;Humans;Induced Pluripotent Stem Cells;Mental Disorders;Models, Biological;Neurobiology;Neurons;Outline;Patients;Stem Cells;Technology		Vadodaria, Krishna C;Amatya, Debha N;Marchetto, Maria C;Gage, Fred H	[Salk Institute for Biological Studies];[Salk Institute for Biological Studies];[Salk Institute for Biological Studies];[Salk Institute for Biological Studies]	2.06	38	Genome medicine	10	1	1
U19MH106434	Group 3								10.1098/rsob.180031	29794033	2018	Prediction of response to drug therapy in psychiatric disorders.	Personalized medicine has become increasingly relevant to many medical fields, promising more efficient drug therapies and earlier intervention. The development of personalized medicine is coupled with the identification of biomarkers and classification algorithms that help predict the responses of different patients to different drugs. In the last 10 years, the Food and Drug Administration (FDA) has approved several genetically pre-screened drugs labelled as pharmacogenomics in the fields of oncology, pulmonary medicine, gastroenterology, haematology, neurology, rheumatology and even psychiatry. Clinicians have long cautioned that what may appear to be similar patient-reported symptoms may actually arise from different biological causes. With growing populations being diagnosed with different psychiatric conditions, it is critical for scientists and clinicians to develop precision medication tailored to individual conditions. Genome-wide association studies have highlighted the complicated nature of psychiatric disorders such as schizophrenia, bipolar disorder, major depression and autism spectrum disorder. Following these studies, association studies are needed to look for genomic markers of responsiveness to available drugs of individual patients within the population of a specific disorder. In addition to GWAS, the advent of new technologies such as brain imaging, cell reprogramming, sequencing and gene editing has given us the opportunity to look for more biomarkers that characterize a therapeutic response to a drug and to use all these biomarkers for determining treatment options. In this review, we discuss studies that were performed to find biomarkers of responsiveness to different available drugs for four brain disorders: bipolar disorder, schizophrenia, major depression and autism spectrum disorder. We provide recommendations for using an integrated method that will use available techniques for a better prediction of the most suitable drug.	Antipsychotic Agents;Autism Spectrum Disorder;Bipolar Disorder;Clinical Trials as Topic;Depressive Disorder, Major;Genetic Markers;Humans;Mental Disorders;Pharmacogenetics;Pharmacogenomic Variants;Precision Medicine;Schizophrenia	Algorithms;Antipsychotic Agents;Association;Autism Spectrum Disorder;Biomarkers;Biopharmaceuticals;Bipolar Disorder;Brain Diseases;Brain Imaging;Cellular Reprogramming;Classification;Clinical Trials as Topic;Depression;Depressive Disorder, Major;Drug Therapy;Gastroenterology;Gene Editing;Genetic Markers;Genome-Wide Association Study;Genomics;Hematology;Humans;Mental Disorders;Methods;Nature;Neurology;News;Patients;Pharmaceutical Preparations;Pharmacogenetics;Pharmacogenomic Variants;Pharmacogenomics;Population;Precision Medicine;Psychiatry;Pulmonary Medicine;Review;Rheumatology;Schizophrenia;Technology;Therapeutics;United States Food and Drug Administration	autism spectrum disorder;bipolar disorder;classification;major depression;prediction;schizophrenia	Stern, Shani;Linker, Sara;Vadodaria, Krishna C;Marchetto, Maria C;Gage, Fred H	[Salk Institute for Biological Studies];[Salk Institute for Biological Studies];[Salk Institute for Biological Studies];[Salk Institute for Biological Studies];[Salk Institute for Biological Studies]	1.94	27	Open biology	8	5	
