Grant Number	Group	Modality	GEO accession	SRA accession	PRIDE accession	OMERO accession	Other database	Other database accession	DOI	PMID	Pub Year	Title	Abstract	MeSH Keywords	MeSH Extracted	PubMed Keywords	Authors	Author Affiliation	RCR	Total Citations	Journal Name	Journal Volume	Journal Issue	Journal Pages
U01MH115746	Group 5								10.1186/s13229-019-0278-0	31198525	2019	CYFIP1 overexpression increases fear response in mice but does not affect social or repetitive behavioral phenotypes.	CYFIP1, a protein that interacts with FMRP and regulates protein synthesis and actin dynamics, is overexpressed in Dup15q syndrome as well as autism spectrum disorder (ASD). While CYFIP1 heterozygosity has been rigorously studied due to its loss in 15q11.2 deletion, Prader-Willi and Angelman syndrome, the effects of CYFIP1 overexpression, as is observed in patients with CYFIP1 duplication, are less well understood. We developed and validated a mouse model of human CYFIP1 overexpression (CYFIP1 OE) using qPCR and western blot analysis. We performed a large battery of behavior testing on these mice, including ultrasonic vocalizations, three-chamber social assay, home-cage behavior, Y-maze, elevated plus maze, open field test, Morris water maze, fear conditioning, prepulse inhibition, and the hot plate assay. We also performed RNA sequencing and analysis on the basolateral amygdala. Extensive behavioral testing in CYFIP1 OE mice reveals no changes in the core behaviors related to ASD: social interactions and repetitive behaviors. However, we did observe mild learning deficits and an exaggerated fear response. Using RNA sequencing of the basolateral amygdala, a region associated with fear response, we observed changes in pathways related to cytoskeletal regulation, oligodendrocytes, and myelination. We also identified GABA-A subunit composition changes in basolateral amygdala neurons, which are essential components of the neural fear conditioning circuit. Overall, this research identifies the behavioral and molecular consequences of CYFIP1 overexpression and how they contribute to the variable phenotype seen in Dup15q syndrome and in ASD patients with excess CYFIP1.	Adaptor Proteins, Signal Transducing;Animals;Anxiety;Autism Spectrum Disorder;Basolateral Nuclear Complex;Behavior, Animal;Cytoskeleton;Fear;GABAergic Neurons;Humans;Intellectual Disability;Interneurons;Learning;Memory Disorders;Mice, Inbred C57BL;Myelin Sheath;Phenotype;Social Behavior	Actins;Adaptor Proteins, Signal Transducing;Affect;Angelman Syndrome;Animals;Anxiety;Autism Spectrum Disorder;Basolateral Nuclear Complex;Behavior;Behavior, Animal;Blot, Western;Cytoskeleton;Elevated Plus Maze Test;Fear;GABAergic Neurons;Humans;Intellectual Disability;Interneurons;Learning;Memory Disorders;Mice;Mice, Inbred C57BL;Morris Water Maze Test;Myelin Sheath;Neurodevelopmental Disorders;Neurons;Oligodendroglia;Open Field Test;Overall;Patients;Phenotype;Polymerase Chain Reaction;Prepulse Inhibition;Proteins;Regulation;Research;Sequence Determinations, RNA;Social Behavior;Social Interaction;Syndrome;Ultrasonics;gamma-Aminobutyric Acid	Autism spectrum disorder (ASD);CYFIP1;Dup15q;Fear conditioning;Mouse behavior;Neurodevelopmental disorders;RNA sequencing	Fricano-Kugler, Catherine;Gordon, Aaron;Shin, Grace;Gao, Kun;Nguyen, Jade;Berg, Jamee;Starks, Mary;Geschwind, Daniel H	[David Geffen School of Medicine, University of California, Los Angeles];[David Geffen School of Medicine, University of California, Los Angeles];[David Geffen School of Medicine, University of California, Los Angeles];[David Geffen School of Medicine, University of California, Los Angeles];[David Geffen School of Medicine, University of California, Los Angeles];[David Geffen School of Medicine, University of California, Los Angeles];[David Geffen School of Medicine, University of California, Los Angeles];[David Geffen School of Medicine, University of California, Los Angeles]	0.85	10	Molecular autism	10		25
U01MH115746	Group 5								10.1016/j.cell.2019.01.015	30901538	2019	Defining the Genetic, Genomic, Cellular, and Diagnostic Architectures of Psychiatric Disorders.	Studies of the genetics of psychiatric disorders have become one of the most exciting and fast-moving areas in human genetics. A decade ago, there were few reproducible findings, and now there are hundreds. In this review, we focus on the findings that have illuminated the genetic architecture of psychiatric disorders and the challenges of using these findings to inform our understanding of pathophysiology. The evidence is now overwhelming that psychiatric disorders are "polygenic"-that many genetic loci contribute to risk. With the exception of a subset of those with ASD, few individuals with a psychiatric disorder have a single, deterministic genetic cause; rather, developing a psychiatric disorder is influenced by hundreds of different genetic variants, consistent with a polygenic model. As progressively larger studies have uncovered more about their genetic architecture, the need to elucidate additional architectures has become clear. Even if we were to have complete knowledge of the genetic architecture of a psychiatric disorder, full understanding requires deep knowledge of the functional genomic architecture-the implicated loci impact regulatory processes that influence gene expression and the functional coordination of genes that control biological processes. Following from this is cellular architecture: of all brain regions, cell types, and developmental stages, where and when are the functional architectures operative? Given that the genetic architectures of different psychiatric disorders often strongly overlap, we are challenged to re-evaluate and refine the diagnostic architectures of psychiatric disorders using fundamental genetic and neurobiological data.	Alleles;Gene Frequency;Genetic Predisposition to Disease;Genetic Variation;Genome-Wide Association Study;Genomics;Humans;Mental Disorders;Mental Health;Multifactorial Inheritance	Alleles;Architecture;Biological Processes;Brain;Cells;Comprehension;Gene Expression;Gene Frequency;Genes;Genetic Loci;Genetic Predisposition to Disease;Genetic Variation;Genetics;Genome-Wide Association Study;Genomics;Human Genetics;Humans;Knowledge;Mental Disorders;Mental Health;Multifactorial Inheritance;Needs;Review;Risk		Sullivan, Patrick F;Geschwind, Daniel H	[Karolinska Institute, University of North Carolina, Chapel Hill];[David Geffen School of Medicine, University of California, Los Angeles]	10.87	145	Cell	177	1	162-183
U01MH115747	Group 6	Proteomics					NDEx	f93f402c-86d4-11e7-a10d-0ac135e8bacf, 08ba2a31-86da-11e7-a10d-0ac135e8bacf, 18dc9109-86da-11e7-a10d-0ac135e8bacf	10.1016/j.isci.2019.05.025	31174177	2019	A Fast and Flexible Framework for Network-Assisted Genomic Association.	We present an accessible, fast, and customizable network propagation system for pathway boosting and interpretation of genome-wide association studies. This system-NAGA (Network Assisted Genomic Association)-taps the NDEx biological network resource to gain access to thousands of protein networks and select those most relevant and performative for a specific association study. The method works efficiently, completing genome-wide analysis in under 5 minutes on a modern laptop computer. We show that NAGA recovers many known disease genes from analysis of schizophrenia genetic data, and it substantially boosts associations with previously unappreciated genes such as amyloid beta precursor. On this and seven other gene-disease association tasks, NAGA outperforms conventional approaches in recovery of known disease genes and replicability of results. Protein interactions associated with disease are visualized and annotated in Cytoscape, which, in addition to standard programmatic interfaces, allows for downstream analysis.		Amyloid beta-Peptides;Association;Bio-Informatics;Biological Science Disciplines;Biopharmaceuticals;Computers;Disease;Genes;Genetics;Genome;Genome-Wide Association Study;Genomics;Methods;Proteins;Resources;Schizophrenia;Standards;Work	Bioinformatics;Biological Sciences;Genomics	Carlin, Daniel E;Fong, Samson H;Qin, Yue;Jia, Tongqiu;Huang, Justin K;Bao, Bokan;Zhang, Chao;Ideker, Trey	[University of California, San Diego];[University of California, San Diego];[University of California, San Diego];[University of California, San Diego];[University of California, San Diego];[University of California, San Diego];[University of California, San Diego];[University of California, San Diego]	0.53	8	iScience	16		155-161
U01MH115747	Group 6	Review							10.1371/journal.pgen.1008519	31770365	2019	The great hairball gambit.		Genetic Loci;Genetic Predisposition to Disease;Genome-Wide Association Study;Humans;Metabolic Networks and Pathways;Protein Interaction Maps	Genetic Loci;Genetic Predisposition to Disease;Genome-Wide Association Study;Humans;Metabolic Networks and Pathways;Protein Interaction Maps		Flint, Jonathan;Ideker, Trey	[University of California, Los Angeles];[University of California, San Diego]	0.61	11	PLoS genetics	15	11	e1008519
U01MH115747	Group 6								10.1038/s42003-019-0411-9	31069265	2019	Automated four-dimensional long term imaging enables single cell tracking within organotypic brain slices to study neurodevelopment and degeneration.	Current approaches for dynamic profiling of single cells rely on dissociated cultures, which lack important biological features existing in tissues. Organotypic slice cultures preserve aspects of structural and synaptic organisation within the brain and are amenable to microscopy, but established techniques are not well adapted for high throughput or longitudinal single cell analysis. Here we developed a custom-built, automated confocal imaging platform, with improved organotypic slice culture and maintenance. The approach enables fully automated image acquisition and four-dimensional tracking of morphological changes within individual cells in organotypic cultures from rodent and human primary tissues for at least 3 weeks. To validate this system, we analysed neurons expressing a disease-associated version of huntingtin (HTT586Q138-EGFP), and observed that they displayed hallmarks of Huntington's disease and died sooner than controls. By facilitating longitudinal single-cell analyses of neuronal physiology, our system bridges scales necessary to attain statistical power to detect developmental and disease phenotypes.	Amino Acid Substitution;Animals;Animals, Newborn;Cell Differentiation;Cell Tracking;Gene Expression;Hippocampus;Humans;Huntingtin Protein;Huntington Disease;Mice;Mice, Inbred C57BL;Microscopy, Confocal;Models, Biological;Neural Stem Cells;Neurons;Primary Cell Culture;Single-Cell Analysis;Tissue Culture Techniques	Amino Acid Substitution;Animals;Animals, Newborn;Biopharmaceuticals;Brain;Cell Differentiation;Cell Tracking;Cells;Culture;Customs;Disease;Disease Models, Animal;Gene Expression;Hippocampus;Humans;Huntingtin Protein;Huntington Disease;Maintenance;Mice;Mice, Inbred C57BL;Microscopy;Microscopy, Confocal;Models, Biological;Neural Stem Cells;Neurons;Organizations;Phenotype;Physiology;Power, Psychological;Primary Cell Culture;Rodentia;Scales;Single-Cell Analysis;Time-Lapse Imaging;Tissue Culture Techniques;Tissues	Animal disease models;Confocal microscopy;Neurodegeneration;Time-lapse imaging;Tissue culture	Linsley, Jeremy W;Tripathi, Atmiyata;Epstein, Irina;Schmunk, Galina;Mount, Elliot;Campioni, Matthew;Oza, Viral;Barch, Mariya;Javaherian, Ashkan;Nowakowski, Tomasz J;Samsi, Siddharth;Finkbeiner, Steven	;;;[University of California, San Francisco];;;;;;[University of California, San Francisco];[Luxembourg Center for Systems Biomedicine, MIT Lincoln Laboratory, University of Luxembourg];[Gladstone Institutes, University of California, San Francisco]	0.89	12	Communications biology	2		155
U01MH115747	Group 6								10.1016/j.brainres.2019.146470	31542572	2019	Human brain development through the lens of cerebral organoid models.	The brain is one of the most complex organs in the body, which emerges from a relatively simple set of basic 'building blocks' during early development according to complex cellular and molecular events orchestrated through a set of inherited instructions. Innovations in stem cell technologies have enabled modelling of neural cells using two- and three-dimensional cultures. In particular, cerebral ('brain') organoids have taken the center stage of brain development models that have the potential for providing meaningful insight into human neurodevelopmental and neurological disorders. We review the current understanding of cellular events during human brain organogenesis, and the events occurring during cerebral organoid differentiation. We highlight the strengths and weaknesses of this experimental model system. In particular, we explain evidence that organoids can mimic many aspects of early neural development, including neural induction, patterning, and broad neurogenesis and gliogenesis programs, offering the opportunity to study genetic regulation of these processes in a human context. Several shortcomings of the current culture methods limit the utility of cerebral organoids to spontaneously give rise to many important cell types, and to model higher order features of tissue organization. We suggest that future studies aim to improve these features in order to make them better models for the study of laminar organization, circuit formation and how disruptions of these processes relate to disease.	Animals;Brain;Cell Differentiation;Humans;Induced Pluripotent Stem Cells;Models, Neurological;Neurogenesis;Neurons;Organogenesis;Organoids	Animals;Brain;Cell Differentiation;Cells;Comprehension;Culture;Disease;Experimental Model;Future;Genetics;Humans;Induced Pluripotent Stem Cells;Instruction;Methods;Models, Neurological;Nervous System Diseases;Neurogenesis;Neurons;Organizations;Organogenesis;Organoids;Program;Regulation;Review;Stem Cells;Technology;Tissues	Brain organoids;Neural development	Andrews, Madeline G;Nowakowski, Tomasz J	[University of California, San Francisco];[BioHub, University of California, San Francisco]	0.78	12	Brain research	1725		146470
U01MH115747	Group 6								10.1038/s41436-019-0576-0	31263215	2019	DYRK1A-related intellectual disability: a syndrome associated with congenital anomalies of the kidney and urinary tract.	Haploinsufficiency of DYRK1A causes a recognizable clinical syndrome. The goal of this paper is to investigate congenital anomalies of the kidney and urinary tract (CAKUT) and genital defects (GD) in patients with DYRK1A variants. A large database of clinical exome sequencing (ES) was queried for de novo DYRK1A variants and CAKUT/GD phenotypes were characterized. Xenopus laevis (frog) was chosen as a model organism to assess Dyrk1a's role in renal development. Phenotypic details and variants of 19 patients were compiled after an initial observation that one patient with a de novo pathogenic variant in DYRK1A had GD. CAKUT/GD data were available from 15 patients, 11 of whom presented with CAKUT/GD. Studies in Xenopus embryos demonstrated that knockdown of Dyrk1a, which is expressed in forming nephrons, disrupts the development of segments of embryonic nephrons, which ultimately give rise to the entire genitourinary (GU) tract. These defects could be rescued by coinjecting wild-type human DYRK1A RNA, but not with DYRK1AR205* or DYRK1AL245R RNA. Evidence supports routine GU screening of all individuals with de novo DYRK1A pathogenic variants to ensure optimized clinical management. Collectively, the reported clinical data and loss-of-function studies in Xenopus substantiate a novel role for DYRK1A in GU development.	Adolescent;Adult;Animals;Child;Child, Preschool;Databases, Genetic;Disease Models, Animal;Exome;Female;Haploinsufficiency;Humans;Intellectual Disability;Kidney;Male;Nephrons;Protein Serine-Threonine Kinases;Protein-Tyrosine Kinases;Urinary Tract;Urogenital Abnormalities;Whole Exome Sequencing;Xenopus laevis;Young Adult	Adolescent;Adult;Animals;Child;Child, Preschool;Database;Databases, Genetic;Disease Models, Animal;Embryo;Exome;Female;Genitalia;Goals;Haploinsufficiency;Humans;Intellectual Disability;Kidney;Male;Nephrons;Observation;Paper;Patients;Phenotype;Protein-Serine-Threonine Kinases;Protein-Tyrosine Kinases;RNA;Role;Screening;Syndrome;Urinary Tract;Urogenital Abnormalities;Whole Exome Sequencing;Xenopus;Xenopus laevis;Young Adult	CAKUT;DYRK1A;Xenopus;exome sequencing;kidney	Blackburn, Alexandria T M;Bekheirnia, Nasim;Uma, Vanessa C;Corkins, Mark E;Xu, Yuxiao;Rosenfeld, Jill A;Bainbridge, Matthew N;Yang, Yaping;Liu, Pengfei;Madan-Khetarpal, Suneeta;Delgado, Mauricio R;Hudgins, Louanne;Krantz, Ian;Rodriguez-Buritica, David;Wheeler, Patricia G;Al-Gazali, Lihadh;Mohamed Saeed Mohamed Al Shamsi, Aisha;Gomez-Ospina, Natalia;Chao, Hsiao-Tuan;Mirzaa, Ghayda M;Scheuerle, Angela E;Kukolich, Mary K;Scaglia, Fernando;Eng, Christine;Willsey, Helen Rankin;Braun, Michael C;Lamb, Dolores J;Miller, Rachel K;Bekheirnia, Mir Reza	[McGovern Medical School, The University of Texas MD Anderson Cancer Center, University of Texas Health Science Center at Houston];[Baylor College of Medicine, Texas Children's Cancer Center];[Baylor College of Medicine];[McGovern Medical School, University of Texas Health Science Center at Houston];[University of California, Berkeley, University of California, San Francisco];[Baylor College of Medicine];[Codified Genomics, LLC, Rady Children's Institute for Genomic Medicine];[Baylor College of Medicine];[Baylor College of Medicine];[Children's Hospital of Pittsburgh, University of Pittsburgh School of Medicine];[UT Southwestern Medical Center];[Stanford University];[Children's Hospital of Philadelphia, Perelman School of Medicine, University of Pennsylvania];[McGovern Medical School, University of Texas School of Public Health];;[United Arab Emirates University];[Tawam Hospital];[Stanford University];[Baylor College of Medicine, Texas Children's Cancer Center];[Center for Integrative Brain Research Seattle, Children's National Medical Center, University of Washington];[UT Southwestern Medical Center];[Cook Children's Medical Center];[Baylor College of Medicine, Prince of Wales Hospital, Texas Children's Cancer Center];[Baylor College of Medicine];[University of California, Berkeley, University of California, San Francisco];[Baylor College of Medicine, Texas Children's Cancer Center];[Weill Cornell Medicine];[McGovern Medical School, The University of Texas MD Anderson Cancer Center, University of Texas Health Science Center at Houston];[Baylor College of Medicine, Texas Children's Cancer Center]	0.83	11	Genetics in medicine : official journal of the American College of Medical Genetics	21	12	2755-2764
U01MH115747	Group 6								10.1016/j.cell.2019.07.046	31474367	2019	Anti-CRISPR-Associated Proteins Are Crucial Repressors of Anti-CRISPR Transcription.	Phages express anti-CRISPR (Acr) proteins to inhibit CRISPR-Cas systems that would otherwise destroy their genomes. Most acr genes are located adjacent to anti-CRISPR-associated (aca) genes, which encode proteins with a helix-turn-helix DNA-binding motif. The conservation of aca genes has served as a signpost for the identification of acr genes, but the function of the proteins encoded by these genes has not been investigated. Here we reveal that an acr-associated promoter drives high levels of acr transcription immediately after phage DNA injection and that Aca proteins subsequently repress this transcription. Without Aca activity, this strong transcription is lethal to a phage. Our results demonstrate how sufficient levels of Acr proteins accumulate early in the infection process to inhibit existing CRISPR-Cas complexes in the host cell. They also imply that the conserved role of Aca proteins is to mitigate the deleterious effects of strong constitutive transcription from acr promoters.	Bacteriophages;CRISPR-Associated Proteins;CRISPR-Cas Systems;Clustered Regularly Interspaced Short Palindromic Repeats;Escherichia coli;Promoter Regions, Genetic;Pseudomonas aeruginosa;Transcription Factors;Transcription, Genetic;Viral Proteins	Bacteriophages;CRISPR-Associated Proteins;CRISPR-Cas Systems;Cells;Clustered Regularly Interspaced Short Palindromic Repeats;DNA;Drive;Escherichia coli;Gene Transfer, Horizontal;Genes;Genome;Infections;Injections;Promoter Regions, Genetic;Proteins;Pseudomonas aeruginosa;Role;Transcription Factors;Transcription, Genetic;Viral Proteins	CRISPR-Cas;Horizontal gene transfer;Phage;Pseudomonas aeruginosa;Transcriptional regulator;anti-CRISPR	Stanley, Sabrina Y;Borges, Adair L;Chen, Kuei-Ho;Swaney, Danielle L;Krogan, Nevan J;Bondy-Denomy, Joseph;Davidson, Alan R	[University of Toronto];[University of California, San Francisco];[Gladstone Institutes];[Gladstone Institutes, Quantitative Biosciences Institute, University of California, San Francisco];[Gladstone Institutes, Quantitative Biosciences Institute, University of California, San Francisco];[Quantitative Biosciences Institute, University of California, San Francisco];[University of Toronto]	3.60	46	Cell	178	6	1452-1464.e13
U01MH115747	Group 6								10.1016/j.gde.2019.04.005	31288129	2019	Mapping the protein-protein and genetic interactions of cancer to guide precision medicine.	Massive efforts to sequence cancer genomes have compiled an impressive catalogue of cancer mutations, revealing the recurrent exploitation of a handful of 'hallmark cancer pathways'. However, unraveling how sets of mutated proteins in these and other pathways hijack pro-proliferative signaling networks and dictate therapeutic responsiveness remains challenging. Here, we show that cancer driver protein-protein interactions are enriched for additional cancer drivers, highlighting the power of physical interaction maps to explain known, as well as uncover new, disease-promoting pathway interrelationships. We hypothesize that by systematically mapping the protein-protein and genetic interactions in cancer-thereby creating Cancer Cell Maps-we will create resources against which to contextualize a patient's mutations into perturbed pathways/complexes and thereby specify a matching targeted therapeutic cocktail.	Computational Biology;Databases, Genetic;Epistasis, Genetic;Gene Regulatory Networks;Humans;Mutation;Neoplasms;Precision Medicine;Protein Interaction Maps;Signal Transduction	Cancer;Catalog;Cells;Computational Biology;Databases, Genetic;Disease;Epistasis, Genetic;Gene Regulatory Networks;Genetics;Genome;Humans;Map;Mutation;Neoplasms;News;Patients;Power, Psychological;Precision Medicine;Protein Interaction Maps;Proteins;Resources;Signal Transduction;Therapeutics		Bouhaddou, Mehdi;Eckhardt, Manon;Chi Naing, Zun Zar;Kim, Minkyu;Ideker, Trey;Krogan, Nevan J	[Quantitative Biosciences Institute, University of California, San Francisco];[Quantitative Biosciences Institute, University of California, San Francisco];[Quantitative Biosciences Institute, University of California, San Francisco];[Quantitative Biosciences Institute, University of California, San Francisco];[University of California, San Diego];[Quantitative Biosciences Institute, University of California, San Francisco]	0.69	11	Current opinion in genetics & development	54		110-117
